id,enota,tip,leto,adaptirano,nadstropje,velikost,cena,agencija,opis
6219638,LJ. CENTER,trisobno,1988,2008,4,75.5,279000.0,"Stoja trade, d.o.o., Ljubljana","75,5 m2, 3-sobno, zgrajeno l. 1988, adaptirano l. 2008, 4. nad., Prodamo lepo renovirano stanovanje na mirni in zeleni l..."
6069621,LJ. CENTER,dvoinpolsobno,2012,2012,4,128.81,499000.0,Rojal invest d.o.o.,"128,81 m2, 2,5-sobno, adaptirano l. 2012, 4/4 nad., prodamo. Cena: 499.000,00 EUR"
6210599,LJ. CENTER,štirisobno,1895,2015,2,108.0,688000.0,Zasebna ponudba,"108 m2, 4-sobno, zgrajeno l. 1895, adaptirano l. 2015, 2/3 nad., Čudovito stanovanje v neposredni bližini univerze. Zago..."
6207946,LJ. CENTER,dvosobno,1895,2002,2,61.0,228000.0,"Dom-in, agencija d.o.o.","61 m2, 2-sobno, zgrajeno l. 1895, adaptirano l. 2002, 2/5 nad., Svetlo meščansko stanovanje v ožjem centru mesta, obrnje..."
6216044,LJ. CENTER,petsobno,1896,None,1,330.7,1200000.0,Rocco nepremičnine d.o.o.,"330,7 m2, 5 in večsobno, zgrajeno l. 1896, 1. nad., Na odlični lokaciji v središču Ljubljane, se v prvem nadstropju star..."
6159289,LJ. CENTER,trisobno,2017,None,VP,107.0,495000.0,"CIMER, MAKSIMILJAN REMIC s.p.","107 m2, 3-sobno, zgrajeno l. 2017, VP/2 nad., Prijetno stanovanje z visokimi stropi v neposredni bližini Drame z veliko ..."
6188469,LJ. CENTER,enoinpolsobno,1931,2006,M,39.3,149000.0,Zasebna ponudba,"39,3 m2, 1,5-sobno, v stavbi zgrajeni l. 1931, adaptirano l. 2006, M/4 nad., prodamo. Cena: 149.000,00 EUR"
6215474,LJ. CENTER,dvosobno,1931,1995,4,43.3,169000.0,Makra as Marko Krajner s.p.,"43,3 m2, 2-sobno, zgrajeno l. 1931, adaptirano l. 1995, 4/4 nad., V samem centra mesta na Dvorakovi ulici v staromeščans..."
6185719,LJ. CENTER,trisobno,2009,None,None,81.26,268000.0,Lares nepremičninska družba d.o.o.,"81,26 m2, 3-sobno, zgrajeno l. 2009, 34 m2 zemljišča, Stanovanje z atrijem v izmeri 34 m2 vam nudi prijetno bivanje v so..."
6216982,LJ. CENTER,dvosobno,1929,2000,3,76.0,257000.0,"Nepremičninska agencija ""TLORIS"" Miro Torić s.p., Poslovna enota","76 m2, 2-sobno, zgrajeno l. 1929, adaptirano l. 2000, 3/5 nad., prodamo. Cena: cca 257.000,00 EUR"
6216910,LJ. CENTER,trisobno,1929,2010,2,88.0,247000.0,Zasebna ponudba,"88 m2, 3-sobno, zgrajeno l. 1929, adaptirano l. 2010, 2/4 nad., Lj. center 88 m2, 3-sobno meščansko stanovanje, velike s..."
6214350,LJ. CENTER,trisobno,1930,2000,1,121.4,299000.0,"Stoja trade, d.o.o., Ljubljana","121,4 m2, 3-sobno, zgrajeno l. 1930, adaptirano l. 2000, 1. nad., Prodamo razgibano staro-meščansko stanovanje v starem ..."
6194635,LJ. CENTER,trisobno,1930,2000,1,121.4,299000.0,Zasebna ponudba,"121,4 m2, 3-sobno, zgrajeno l. 1930, adaptirano l. 2000, 1/3 nad., Ugoden nakup kot investicija. Zelo primerno za oddaja..."
6209073,LJ. CENTER,trisobno,1965,2013,3,91.6,390000.0,"ETAŽA nepremičnine, Tomaž Lenart s.p.","91,6 m2, 3-sobno, zgrajeno l. 1965, adaptirano l. 2013, 3/6 nad., zelo svetlo v celoti obnovljeno in takoj vseljivo stan..."
6221053,LJ. CENTER,trisobno,1906,2006,M,67.3,179000.0,"JA Invest, d.o.o.","67,3 m2, 3-sobno, zgrajeno l. 1906, adaptirano l. 2006, mansarda, Ljubljana center - Hradeckega cesta pod Golovcem, 3 so..."
6220575,LJ. CENTER,enoinpolsobno,1906,2016,M,44.0,122000.0,Zasebna ponudba,"44 m2, 1,5-sobno, zgrajeno l. 1906, adaptirano l. 2016, M/2 nad., opremljeno, elektrika, vodovod, kanalizacija, tk, park..."
6213225,LJ. CENTER,dvosobno,1954,2015,2,72.0,212000.0,"Nepremičninska agencija ""TLORIS"" Miro Torić s.p., Poslovna enota","72 m2, 2-sobno, zgrajeno l. 1954, adaptirano l. 2015, 2/5 nad., prodamo. Cena: 212.000,00 EUR"
6216461,LJ. CENTER,dvosobno,1965,2005,6,39.5,175000.0,Mernet d.o.o.,"39,5 m2, 2-sobno, zgrajeno l. 1965, adaptirano l. 2005, 6/8 nad., V urejenem bloku z novo fasado, v neposrednji blizini ..."
6190939,LJ. CENTER,trisobno,1891,None,VP,79.7,290000.0,"Nepremičninska družba d.o.o., PE RE/MAX Vogal","79,7 m2, 3-sobno, zgrajeno l. 1891, 92 m2 zemljišča, VP/3 nad., prodamo. Cena: 290.000,00 EUR"
6199213,LJ. CENTER,dvosobno,2000,None,1,65.0,290000.0,Medvešek Pušnik Nepremičnine d.o.o.,"65 m2, 2-sobno, zgrajeno l. 2000, 1. nad., povsem v središču prestolnice, v elitni stanovanjski stavbi, pogled proti sto..."
6199196,LJ. CENTER,dvosobno,2000,None,1,65.0,290000.0,"A-KOTA d.o.o., PE Ljubljana","65 m2, 2-sobno, zgrajeno l. 2000, 1/6 nad., LJ. -Center; Kapitelj, prodamo opremljeno 2ss ( bruto 65 m2) s shrambo in pa..."
6219704,LJ. CENTER,trisobno,1969,None,5,76.6,279000.0,Agencija Katja d.o.o.,"76,6 m2, 3-sobno, zgrajeno l. 1969, 5/12 nad., obnovljeno in opremljeno stanovanje se nahaja v urejeni stolpnici. Stanov..."
6217879,LJ. CENTER,dvosobno,1975,None,4,60.0,208000.0,Casa 69 d.o.o.,"60 m2, 2-sobno, zgrajeno l. 1975, 4/4 nad., Predstavljamo vam izredno prostorno in popolnoma obnovljeno dvosobno stanova..."
6212661,LJ. CENTER,štirisobno,2019,None,1,134.32,650000.0,Rocco nepremičnine d.o.o.,"134,32 m2, 4-sobno, novogradnja - zgr. l. 2019, 1. nad., Sodobno zgrajen objekt v neposredni bližini mestnega središča. ..."
6076324,LJ. CENTER,dvosobno,1900,2016,P,44.4,177900.0,Mapros d.o.o.,"44,4 m2, 2-sobno, zgrajeno l. 1900, adaptirano l. 2016, P/4 nad., Stanovanje je primerno tudi kot poslovni prostor ali p..."
6219432,LJ. CENTER,enosobno,1961,2017,5,23.3,128000.0,Zasebna ponudba,"23,3 m2, 1-sobno, zgrajeno l. 1961, adaptirano l. 2017, 5/5 nad., Prodamo udobno in svetlo 1-sobno stanovanje na Kristan..."
6219316,LJ. CENTER,enosobno,1991,None,1,51.3,198000.0,Vilar d.o.o.,"51,3 m2, 1-sobno, zgrajeno l. 1991, 1/4 nad., CK iz toplotne postaje, optika, parkiranje z dovolilnico, strogi center me..."
6218842,LJ. CENTER,štirisobno,1991,2017,1,98.7,399000.0,Mernet d.o.o.,"98,7 m2, 4-sobno, zgrajeno l. 1991, adaptirano l. 2017, 1/3 nad., V strogem centru mesta prodamo v novejsi stanovanjski ..."
6200006,LJ. CENTER,dvosobno,2006,None,P,65.4,236000.0,Zasebna ponudba,"65,4 m2, 2-sobno, zgrajeno l. 2006, P/5 nad., Prodamo prtlično stanovanje uporabne površine 65,40 m2 z atrijem, kletjo i..."
6189887,LJ. CENTER,dvosobno,2005,None,None,69.3,265000.0,"Nepremičninska družba d.o.o., PE RE/MAX Vogal","69,3 m2, 2-sobno, zgrajeno l. 2005, prodamo. Cena: 265.000,00 EUR"
6206661,LJ. CENTER,štirisobno,2005,None,3,161.6,550000.0,"Aeon nepremičnine, d.o.o., Century 21 Emona","161,6 m2, 4-sobno, zgrajeno l. 2005, 3. nad., prodamo. Cena: 550.000,00 EUR"
6208777,LJ. CENTER,enosobno,2007,None,1,42.5,160000.0,Zasebna ponudba,"42,5 m2, 1-sobno, zgrajeno l. 2007, 1/5 nad., 1 sobno stanovanje odlična lokacija, pogled proti Roški, prodamo. Cena: 16..."
6200073,LJ. CENTER,dvosobno,2006,None,P,97.2,219000.0,"Abstract nepremičnine, Igor Kerin s.p.","97,2 m2, 2-sobno, zgrajeno l. 2006, pritličje, atrijsko stanovanje 51,9 m2 uporabne površine, V lega, odprta terasa, kle..."
6216651,LJ. CENTER,štirisobno,2007,None,4,161.6,482000.0,Zasebna ponudba,"161,6 m2, 4-sobno, dupleks, zgrajeno l. 2007, 4/4 nad., prodaja, stanovanje, 4-sobno: ljubljana center, mesarska cesta, ..."
6219794,LJ. CENTER,trisobno,2007,2018,P,106.0,375000.0,Trg nepremičnin d.o.o.,"106 m2, 3-sobno, zgrajeno l. 2007, adaptirano l. 2018, P/4 nad., Na odlični lokaciji v centru mesta v moderni soseski zg..."
6163728,LJ. CENTER,štirisobno,2006,None,None,160.7,485000.0,LJUBLJANA NEPREMIČNINE d.o.o.,"160,7 m2, 4-sobno, dupleks, zgrajeno l. 2006, prodamo. Cena: 485.000,00 EUR"
6208263,LJ. CENTER,dvosobno,2006,None,P,59.9,249000.0,"Lobodas, posredništvo in storitve d.o.o.","59,9 m2, 2-sobno, zgrajeno l. 2006, 29 m2 zemljišča, P/4 nad., Atrijsko stanovanje, JZ lega, zadnja vrsta odprt pogled, ..."
6219808,LJ. CENTER,enosobno,1820,2007,2,33.9,149000.0,MESTO NEPREMIČNIN d.o.o.,"33,9 m2, 1-sobno, zgrajeno l. 1820, adaptirano l. 2007, 2/3 nad., staro mestno jedro, odlična lokacija, primerno za inve..."
6214327,LJ. CENTER,dvosobno,1540,2010,2,57.0,199000.0,Rojal invest d.o.o.,"57 m2, 2-sobno, zgrajeno l. 1540, adaptirano l. 2010, 2/2 nad., prodamo. Cena: 199.000,00 EUR"
5610162,LJ. CENTER,dvoinpolsobno,1459,None,None,86.0,288000.0,"Komfort skupina d.o.o., nepremičnine","86 m2, 2,5-sobno, v stavbi zgrajeni l. 1459, prodamo. Cena: 288.000,00 EUR"
6201502,LJ. CENTER,triinpolsobno,1550,2017,2,123.7,399000.0,"Nepremičninska družba d.o.o., PE RE/MAX Vogal","123,7 m2, 3,5-sobno, zgrajeno l. 1550, adaptirano l. 2017, 2/2 nad., prodamo. Cena: 399.000,00 EUR"
6218693,LJ. CENTER,triinpolsobno,1550,None,2,123.7,360000.0,Realia d.o.o.,"123,7 m2, 3,5-sobno, zgrajeno l. 1550, 2. nad., stanovanje se nahaja na Mestnem trgu, umaknjeno od mestnega vrveža in hk..."
6184327,LJ. CENTER,štiriinpolsobno,1800,2018,1,139.5,649000.0,"Oridom nepremičnine, Ivan Orešnik s.p.","139,5 m2, 4,5-sobno, zgrajeno l. 1800, adaptirano l. 2018, 1. nad., Popolnoma obnovljeno, atraktivno, prodamo. Cena: 649..."
6133139,LJ. CENTER,dvosobno,2017,2017,M,101.9,349000.0,Dodoma d.o.o.,"101,9 m2, 2-sobno, adaptirano l. 2017, M/4 nad., prodamo. Cena: 349.000,00 EUR"
6216989,LJ. CENTER,štirisobno,1800,2018,4,197.0,687000.0,Zasebna ponudba,"197 m2, 4-sobno, v stavbi zgrajeni l. 1800, adaptirano l. 2018, 4/4 nad., Izjemna priložnost. V stari Ljubljani, v pravk..."
6191485,LJ. CENTER,trisobno,1920,2013,1,122.0,398000.0,"Ponudba d.o.o., nepremičninska družba","122 m2, 3-sobno, zgrajeno l. 1920, adaptirano l. 2013, 1. nad., prodamo. Cena: 398.000,00 EUR"
6206820,LJ. CENTER,trisobno,1962,2018,4,62.7,197000.0,Akcent d.o.o. Ljubljana,"62,7 m2, 3-sobno, zgrajeno l. 1962, adaptirano l. 2018, 4/4 nad., Posredujemo pri prodaji zelo prijetnega, svetlega, v c..."
6209712,LJ. CENTER,dvosobno,2010,2010,5,56.0,205000.0,Zasebna ponudba,"56 m2, 2-sobno, adaptirano l. 2010, 5/11 nad., v ceno vključena tudi samostojna garaža v izmeri 16 m2, dovolj velika za ..."
6220531,LJ. CENTER,štirisobno,2007,None,4,165.0,399000.0,Zasebna ponudba,"165 m2, 4-sobno, zgrajeno l. 2007, 4/4 nad., LJ- center, čudovit dupleks z bazenom na najbolj iskani lokaciji v ljubljan..."
6183858,LJ. CENTER,petsobno,2017,None,2,190.61,631148.0,Mernet d.o.o.,"190,61 m2, 5 in večsobno, zgrajeno l. 2017, 2/2 nad., na elitni lokaciji v samem središču mesta, v novozgrajenem sodobne..."
6197965,LJ. CENTER,trisobno,1934,2005,2,96.6,259000.0,Mernet d.o.o.,"96,6 m2, 3-sobno, zgrajeno l. 1934, adaptirano l. 2005, 2. nad., V urejeni večstanovanjski hiši, na izjemni lokaciji, pr..."
6206309,LJ. CENTER,trisobno,1930,2015,2,80.0,365000.0,FIRMA nepremičnine Martinović & Co. k.d.,"80 m2, 3-sobno, zgrajeno l. 1930, adaptirano l. 2015, 2/3 nad., prodamo. Cena: 365.000,00 EUR"
6220605,LJ. CENTER,dvosobno,1905,2012,PK,51.1,103000.0,Roni nepremičnine d.o.o.,"51,1 m2, 2-sobno, zgrajeno l. 1905, adaptirano l. 2012, 52 m2 zemljišča, PK/2 nad., prodamo. Cena: 103.000,00 EUR"
6179259,LJ. CENTER,trisobno,2009,None,None,90.0,278000.0,"Nep Nepremičnine, Dejan Kuzma s.p.","90 m2, 3-sobno, zgrajeno l. 2009, Novejše moderno in funkcionalno zasnovano stanovanje, odlična lokacija, mirna soseska,..."
6188592,LJ. CENTER,trisobno,2009,None,P,115.0,268000.0,"Nep Nepremičnine, Dejan Kuzma s.p.","115 m2, 3-sobno, zgrajeno l. 2009, 34 m2 zemljišča, pritličje, Novejše moderno in funkcionalno zasnovano stanovanje, odl..."
6201887,LJ. CENTER,petsobno,2017,None,2,190.61,770000.0,Mernet d.o.o.,"190,61 m2, 5 in večsobno, zgrajeno l. 2017, 2/2 nad., strogi center-elitna lokacija, novozgrajen sodoben objekt, sodobna..."
6189377,LJ. CENTER,dvoinpolsobno,1882,2009,1,63.0,154000.0,"Stoja trade, d.o.o., Ljubljana","63 m2, 2,5-sobno, zgrajeno l. 1882, adaptirano l. 2009, 1. nad., Prodamo urejeno dupleks stanovanje na vrhunski lokaciji..."
6216970,LJ. CENTER,trisobno,1960,2010,1,64.5,189000.0,KREATIVDOM d.o.o.,"64,5 m2, 3-sobno, zgrajeno l. 1960, adaptirano l. 2010, 1/5 nad., Odlična lokacija v centru mesta, parkiranje za zaporni..."
6214901,LJ. CENTER,triinpolsobno,1955,None,1,88.4,396000.0,Casa 69 d.o.o.,"88,4 m2, 3,5-sobno, zgrajeno l. 1955, 1. nad., so vaše sanje in želja živeti v urejenem manjšem vila bloku, v osrčju dog..."
6218314,LJ. CENTER,dvosobno,2012,None,5,60.41,239000.0,"ENOTA real estate, nepremičninsko posredovanje, Eva Golc, s.p","60,41 m2, 2-sobno, zgrajeno l. 2012, 5/20 nad., objekt Situla, 2 sobno stanovanje, nadstandardno, moderno, pogled na cen..."
6201346,LJ. CENTER,dvosobno,2012,None,4,81.97,283000.0,"ENOTA real estate, nepremičninsko posredovanje, Eva Golc, s.p","81,97 m2, 2-sobno, zgrajeno l. 2012, 4/20 nad., objekt Situla, 2 sobno stanovanje, nadstandardno, moderno, pogled na cen..."
6211951,LJ. CENTER,štirisobno,2013,None,16,168.4,750000.0,"ENOTA real estate, nepremičninsko posredovanje, Eva Golc, s.p","168,4 m2, 4-sobno, dupleks, zgrajeno l. 2013, 16/20 nad., 3 parkirna mesta, shramba, dve veliki terasi, pogled na celotn..."
6200732,LJ. CENTER,štirisobno,2012,2017,20,326.3,1500000.0,"ENOTA real estate, nepremičninsko posredovanje, Eva Golc, s.p","326,3 m2, 4-sobno, &quot;penthouse&quot;, zgrajeno l. 2012, adaptirano l. 2017, 20/20 nad., v celoti nadstandardno oprem..."
6218127,LJ. CENTER,trisobno,2006,None,1,103.0,329000.0,Euromark-a d.o.o.,"103 m2, 3-sobno, zgrajeno l. 2006, 1/4 nad., redka priložnost. 3 sobno vogalno stanovanje s čudovito sončno lego zagotav..."
6208509,LJ. CENTER,dvosobno,2001,2001,2,80.75,335000.0,Svet RE d.o.o.,"80,75 m2, 2-sobno, adaptirano l. 2001, 2. nad., staromeščansko v urejeni večstanovanjski stavbi, pogled na Ljubljanico, ..."
6190859,LJ. CENTER,dvosobno,1959,2015,3,43.4,125000.0,"Nepremičninska družba d.o.o., PE RE/MAX Vogal","43,4 m2, 2-sobno, zgrajeno l. 1959, adaptirano l. 2015, 3. nad., dobra lokacija, sončno, s pogledi na Ljubljanski grad, ..."
6219762,LJ. CENTER,dvosobno,1959,None,5,55.9,205000.0,Casa 69 d.o.o.,"55,9 m2, 2-sobno, zgrajeno l. 1959, 5/11 nad., Predstavljamo vam prenovljeno stanovanje po stilu in okusu prijetnega pro..."
6219433,LJ. CENTER,enosobno,1831,2002,M,35.0,148000.0,"Lucia tim d.o.o., PE Nepremičnine","35 m2, 1-sobno, zgrajeno l. 1831, adaptirano l. 2002, M/2 nad., vseljivo takoj, prodamo. Cena: 148.000,00 EUR"
6210065,LJ. CENTER,enosobno,1831,2002,M,35.0,148000.0,Afirmacija d.o.o.,"35 m2, 1-sobno, zgrajeno l. 1831, adaptirano l. 2002, M/2 nad., Na odlični lokaciji ob Ljubljanici v neposredni bližini ..."
6189106,LJ. CENTER,trisobno,1975,2010,VP,94.0,169000.0,Zasebna ponudba,"94 m2, 3-sobno, zgrajeno l. 1975, adaptirano l. 2010, VP/2 nad., prodamo. Cena: 169.000,00 EUR"
6210690,LJ. CENTER,dvosobno,2018,None,1,84.0,309000.0,Agencija Katja d.o.o.,"84 m2, 2-sobno, zgrajeno l. 2018, 1/2 nad., stanovanje se nahaja v bližini centra mesta, ob neposrednem stiku z naravo, ..."
6211856,LJ. CENTER,štirisobno,2018,None,2,140.26,520000.0,Agencija Katja d.o.o.,"140,26 m2, 4-sobno, zgrajeno l. 2018, 2/2 nad., stanovanje se nahaja v bližini centra, ob neposrednem stiku z naravo, v ..."
6208351,LJ. CENTER,garsonjera,2006,2015,3,34.3,158000.0,MESTO NEPREMIČNIN d.o.o.,"34,3 m2, garsonjera, zgrajena l. 2006, adaptirana l. 2015, 3/4 nad., prijetna in funkcionalna garsonjera z balkonom in p..."
6218690,LJ. CENTER,dvosobno,1929,2013,2,84.4,247000.0,MESTO NEPREMIČNIN d.o.o.,"84,4 m2, 2-sobno, zgrajeno l. 1929, adaptirano l. 2013, 2/4 nad., na odlični lokaciji, v bližini Ljubljanice in mestne t..."
6219112,LJ. CENTER,trisobno,1928,2008,P,105.5,289000.0,"Stoja trade, d.o.o., Ljubljana","105,5 m2, 3-sobno, zgrajeno l. 1928, adaptirano l. 2008, pritličje, Prodamo moderno urejeno staro-meščansko stanovanje n..."
6221340,LJ. CENTER,dvosobno,2006,None,2,67.0,247000.0,Zasebna ponudba,"67 m2, 2-sobno, zgrajeno l. 2006, 2/4 nad., prodamo. Cena: 247.000,00 EUR"
6219076,LJ. CENTER,enosobno,1896,2018,None,37.3,129000.0,Inalbea d.o.o.,"37,3 m2, 1-sobno, zgrajeno l. 1896, adaptirano l. 2018, Svetlo, simpatično in popolnoma opremljeno stanovanje, adaptiran..."
6217238,LJ. CENTER,trisobno,1908,None,3,71.7,160000.0,"Nep Nepremičnine, Dejan Kuzma s.p.","71,7 m2, 3-sobno, zgrajeno l. 1908, 3. nad., odlična lokacija, bližina Kliničnega centra in strogega mestnega jedra, zel..."
6177917,LJ. CENTER,štiriinpolsobno,1934,None,2,162.8,495000.0,Group A d.o.o.,"162,8 m2, 4,5-sobno, zgrajeno l. 1934, 2/3 nad., unikatno meščansko stanovanje v stavbi, ki jo je zasnoval Plečnik in im..."
6219850,LJ. CENTER,garsonjera,2004,None,None,32.9,145000.0,"Agencija Tomc, d.o.o.","32,9 m2, garsonjera, zgrajena l. 2004, balkon, parkirno mesto v kletni etaži, dvigalo, prodamo. Cena: 145.000,00 EUR"
2497323,LJ. CENTER,triinpolsobno,1936,2007,M,80.0,190000.0,Zasebna ponudba,"80 m2, 3,5-sobno, zgrajeno l. 1936, adaptirano l. 2007, 50 m2 zemljišča, M/3 nad., prodamo. Cena: do 190.000,00 EUR"
6212009,LJ. CENTER,trisobno,1970,2010,None,86.1,320000.0,Group A d.o.o.,"86,1 m2, 3-sobno, zgrajeno l. 1970, adaptirano l. 2010, moderno in komfortno, neto 79,20 m2 + balkon 8,40 m2 + klet 4,80..."
6158501,LJ. CENTER,trisobno,1880,2012,P,109.3,340000.0,NeSta d.o.o.,"109,3 m2, 3-sobno, zgrajeno l. 1880, adaptirano l. 2012, P/2 nad., V centru mesta s peš dostopom do strogega centra mest..."
6206898,LJ. CENTER,enosobno,1934,None,4,50.8,162000.0,Zasebna ponudba,"50,8 m2, 1-sobno, v stavbi zgrajeni l. 1934, 4/4 nad., V strogem centru, na izvrstni lokaciji, prodamo stanovanje primer..."
6179828,LJ. CENTER,trisobno,1966,2010,3,65.0,215000.0,Zasebna ponudba,"65 m2, 3-sobno, zgrajeno l. 1966, adaptirano l. 2010, 3/4 nad., prodamo. Cena: 215.000,00 EUR"
6211989,LJ. CENTER,dvosobno,1926,2007,3,64.5,250000.0,Nepremičnine Plus d.o.o.,"64,5 m2, 2-sobno, zgrajeno l. 1926, adaptirano l. 2007, 3/3 nad., opremljeno, popolnoma obnovljeno stanovanje na Dvorako..."
6213144,LJ. CENTER,Soba,1963,None,5,10.0,39500.0,"24-ur.eu, Dean Daraboš s.p.","10 m2, soba, zgrajena l. 1963, 5/5 nad., prodamo. Cena: 39.500,00 EUR"
6221173,LJ. CENTER,enosobno,1966,2008,3,40.7,145000.0,MESTO NEPREMIČNIN d.o.o.,"40,7 m2, 1-sobno, zgrajeno l. 1966, adaptirano l. 2008, 3/4 nad., svetlo stanovanje na odlični lokaciji, prodamo. Cena: ..."
6216302,LJ. CENTER,dvosobno,1959,2015,4,47.7,173000.0,MESTO NEPREMIČNIN d.o.o.,"47,7 m2, 2-sobno, zgrajeno l. 1959, adaptirano l. 2015, 4/4 nad., dvosobno stanovanje na odlični lokaciji na Prulah, pro..."
6214365,LJ. CENTER,trisobno,1959,2010,4,62.5,215400.0,MESTO NEPREMIČNIN d.o.o.,"62,5 m2, 3-sobno, zgrajeno l. 1959, adaptirano l. 2010, 4/4 nad., bližina strogega centra, pogled na Ljubljanski grad, p..."
6219514,LJ. CENTER,trisobno,1959,None,4,69.3,215400.0,Casa 69 d.o.o.,"69,3 m2, 3-sobno, zgrajeno l. 1959, 4. nad., imate željo po nakupu funkcionalnega in lepo obnovljenega stanovanja na isk..."
6217174,LJ. CENTER,trisobno,1960,None,8,71.9,209000.0,Zasebna ponudba,"71,9 m2, 3-sobno, v stavbi zgrajeni l. 1960, 8/11 nad., V 8. nadstropju stolpnice na Rozmanovi ulici v centru Ljubljane ..."
6208148,LJ. CENTER,trisobno,1928,2013,1,95.0,255000.0,FIRMA nepremičnine Martinović & Co. k.d.,"95 m2, 3-sobno, zgrajeno l. 1928, adaptirano l. 2013, 1/M, prodamo. Cena: 255.000,00 EUR"
6180324,LJ. CENTER,trisobno,2010,2010,1,165.45,225990.0,"Sans nepremičnine, d.o.o.","165,45 m2, 3-sobno, adaptirano l. 2010, 123 m2 zemljišča, 1/1 nad., Zelo lepo svetlo stanovanje ki ima poseben vhod iz p..."
6221142,LJ. CENTER,dvosobno,2013,None,3,61.0,269000.0,Zasebna ponudba,"61 m2, 2-sobno, zgrajeno l. 2013, 3/8 nad., Nadstandarno polno opremljeno dvosobno stanovanje v Situli 61 m2 + shramba +..."
6210275,LJ. CENTER,trisobno,1969,2016,2,96.0,330000.0,Mreža nepremičnin d.o.o.,"96 m2, 3-sobno, zgrajeno l. 1969, adaptirano l. 2016, 2/5 nad., prodamo. Cena: 330.000,00 EUR"
6175798,LJ. CENTER,trisobno,1956,2011,6,106.45,400000.0,Akustika group d.o.o.,"106,45 m2, 3-sobno, zgrajeno l. 1956, adaptirano l. 2011, 6. nad., prodamo. Cena: 400.000,00 EUR"
6217728,LJ. CENTER,dvosobno,1895,2016,M,57.0,212000.0,Zasebna ponudba,"57 m2, 2-sobno, dupleks, v stavbi zgrajeni l. 1895, adaptirano l. 2016, M/2 nad., plinsko etažno centralno ogrevanje, in..."
6188584,LJ. CENTER,štirisobno,1890,2018,3,126.69,410000.0,Vizija Lina Ina Poglajen s.p.,"126,69 m2, 4-sobno, zgrajeno l. 1890, adaptirano l. 2018, 3/4 nad., prodamo. Cena: 410.000,00 EUR"
6218972,LJ. CENTER,dvoinpolsobno,2005,None,2,80.3,236000.0,Roni nepremičnine d.o.o.,"80,3 m2, 2,5-sobno, zgrajeno l. 2005, 2. nad., odlična lokacija, 2 parkirišča v podzemni garaži, dvigalo, prodamo. Cena:..."
6165431,LJ. CENTER,dvoinpolsobno,2012,2012,4,128.0,499000.0,Ultimo invest d.o.o.,"128 m2, 2,5-sobno, dupleks, adaptirano l. 2012, 4/4 nad., Prodamo novo nadstandardno dupleks stanovanje s pogledom na Lj..."
6213164,LJ. CENTER,trisobno,1800,2010,1,82.2,328000.0,Markasit d.o.o.,"82,2 m2, 3-sobno, zgrajeno l. 1800, adaptirano l. 2010, 1/2 nad., Popolnoma opremljeno, adaptirano (inštalacije, tla, st..."
6218769,LJ. CENTER,trisobno,1959,2010,4,66.15,189000.0,Enepremičnine Ana Ocvirk s.p.,"66,15 m2, 3-sobno, zgrajeno l. 1959, adaptirano l. 2010, 4/11 nad., prodamo. Cena: 189.000,00 EUR"
6182682,LJ. CENTER,dvosobno,1961,2016,6,55.7,165000.0,LJUBLJANA NEPREMIČNINE d.o.o.,"55,7 m2, 2-sobno, zgrajeno l. 1961, adaptirano l. 2016, 6/10 nad., edinstvena lokacija s čudovitim pogledom na ljubljans..."
6218439,LJ. CENTER,dvosobno,1961,None,1,56.0,149000.0,Casa 69 d.o.o.,"56 m2, 2-sobno, zgrajeno l. 1961, 1/10 nad., Svetlo stanovanje s funkcionalnim tlorisom se nahaja v urejenem bloku s pri..."
6221578,LJ. CENTER,štirisobno,1850,2017,3,124.3,410000.0,Rojal invest d.o.o.,"124,3 m2, 4-sobno, zgrajeno l. 1850, adaptirano l. 2017, 3. nad., prodamo. Cena: cca 410.000,00 EUR"
6150437,LJ. CENTER,štirisobno,2016,2016,1,96.0,338000.0,Studio da Vinci d.o.o.,"96 m2, 4-sobno, adaptirano l. 2016, adaptirano l. 2016, 1/2 nad., prodamo. Cena: cca 338.000,00 EUR"
6185703,LJ. CENTER,trisobno,2009,None,None,90.0,282000.0,Lares nepremičninska družba d.o.o.,"90 m2, 3-sobno, zgrajeno l. 2009, Želite svoj dom v centru mesta? Na prodaj je stanovanje v urejeni soseski Njegošev kva..."
6200655,LJ. CENTER,trisobno,1895,2012,2,90.5,319000.0,"Stoja trade, d.o.o., Ljubljana","90,5 m2, 3-sobno, zgrajeno l. 1895, adaptirano l. 2012, 2. nad., Prodamo moderno opremljeno, klimatizirano in v celoti p..."
6218683,LJ. CENTER,petsobno,1906,2005,3,186.3,430000.0,Zasebna ponudba,"186,3 m2, 5 in večsobno, zgrajeno l. 1906, adaptirano l. 2005, 3/3 nad., CENTER - UKC, 6 sobno, optika, TV, garaža, gret..."
6210428,LJ. CENTER,trisobno,1937,None,2,115.1,250000.0,Studio modul d.o.o.,"115,1 m2, 3-sobno, zgrajeno l. 1937, 2/3 nad., Edinstveno in prostorno meščansko stanovanje v neposredni bližini parka T..."
6209656,LJ. CENTER,trisobno,2018,2018,None,85.5,289000.0,Zasebna ponudba,"85,5 m2, 3-sobno, adaptirano l. 2018, adaptirano l. 2018, Popolnoma prenovljeno trosobno stanovanje na robu centra Ljubl..."
6219775,LJ. CENTER,dvosobno,1929,None,2,84.4,239000.0,Casa 69 d.o.o.,"84,4 m2, 2-sobno, zgrajeno l. 1929, 2/4 nad., Iščete stanovanje v centru Ljubljane, katerega lahko obnovite in uredite p..."
6219342,LJ. CENTER,garsonjera,1982,None,4,31.5,125000.0,MESTO NEPREMIČNIN d.o.o.,"31,5 m2, garsonjera, zgrajena l. 1982, 4/7 nad., Trnovski bloki - odlična lokacija, prodamo. Cena: 125.000,00 EUR"
6208517,LJ. CENTER,Soba,2007,2007,VP,53.2,138000.0,Svet RE d.o.o.,"53,2 m2, soba, adaptirana l. 2007, visoko pritličje, na odlični lokaciji, primerno kot investicija (kratkoročni/dolgoroč..."
6218951,LJ. CENTER,dvosobno,1867,2014,P,57.0,153000.0,Inalbea d.o.o.,"57 m2, 2-sobno, zgrajeno l. 1867, adaptirano l. 2014, pritličje, izredno simpatično, svetlo in popolnoma opremljeno stan..."
6219340,LJ. CENTER,trisobno,1982,2012,4,71.2,259000.0,MESTO NEPREMIČNIN d.o.o.,"71,2 m2, 3-sobno, zgrajeno l. 1982, adaptirano l. 2012, 4/7 nad., Trnovski bloki - odlična lokacija, prodamo. Cena: 259...."
6206916,LJ. CENTER,trisobno,1981,2010,5,72.5,310000.0,MESTO NEPREMIČNIN d.o.o.,"72,5 m2, 3-sobno, zgrajeno l. 1981, adaptirano l. 2010, 5/6 nad., izvrstna lokacija ob mestnem središču, prenovljeno in ..."
6176315,LJ. CENTER,štirisobno,2004,None,P,137.16,630000.0,Agencija Barbara nepremičnine d.o.o.,"137,16 m2, 4-sobno, zgrajeno l. 2004, 25,57 m2 zemljišča, pritličje, Prodamo atrijsko stanovanje v večstanovanjskem obje..."
6217126,LJ. CENTER,štiriinpolsobno,2003,None,1,195.0,970000.0,Zasebna ponudba,"195 m2, 4,5-sobno, zgrajeno l. 2003, 1/2 nad., stanovanje LJ - center, trnovo, prodamo. Cena: cca 970.000,00 EUR"
6216370,LJ. CENTER,trisobno,1981,2015,None,79.6,296400.0,Svet RE d.o.o.,"79,6 m2, 3-sobno, zgrajeno l. 1981, adaptirano l. 2015, LJUBLJANA, Trnovo; posredujemo pri prodaji 3 sobnega delno oprem..."
6200179,LJ. CENTER,petsobno,2016,None,None,230.0,890000.0,Kreativa MW d.o.o.,"230 m2, 5 in večsobno, dupleks, zgrajeno l. 2016, v urejenem, uglednem Trnovskem predmestju, premišljeno izdelano s kval..."
6220206,LJ. CENTER,trisobno,1983,2017,3,86.5,390000.0,Arcimboldo d.o.o.,"86,5 m2, 3-sobno, zgrajeno l. 1983, adaptirano l. 2017, 3/7 nad., stanovabnje na izvrstni lokaciji, prodamo. Cena: 390.0..."
6212138,LJ. CENTER,Drugo,1896,2017,None,101.42,390000.0,Rocco nepremičnine d.o.o.,"101,42 m2, stanovanje, zgrajeno l. 1896, adaptirano l. 2017, Na odlični lokaciji blizu centra Ljubljane se v starejši in..."
6205580,LJ. CENTER,dvosobno,1908,2017,P,56.0,220000.0,Enepremičnine Ana Ocvirk s.p.,"56 m2, 2-sobno, zgrajeno l. 1908, adaptirano l. 2017, P/3 nad., prodamo. Cena: 220.000,00 EUR"
6210355,LJ. CENTER,štirisobno,2005,None,1,109.3,490000.0,Elite nepremičnine d.o.o.,"109,3 m2, 4-sobno, zgrajeno l. 2005, 1. nad., nadstandardno stanovanje, 2 parkirni mesti, prodamo. Cena: 490.000,00 EUR"
5535261,LJ. CENTER,petsobno,1993,None,4,132.9,450000.0,Nepremičnine Plus d.o.o.,"132,9 m2, 5 in večsobno, zgrajeno l. 1993, 4/4 nad., dvoetažno, terasa, parkirno mesto, vsi priključki, vseljivo-dogovor..."
