id,enota,tip,leto,adaptirano,nadstropje,velikost,cena,agencija,opis6219428,LJ. VIČ,enoinpolsobno,2003,None,3,35.0,105000.0,Adria nepremičnine d.o.o.,"35 m2, 1,5-sobno, zgrajeno l. 2003, 3/3 nad., Prodamo lepo 1,5 sobno stanovanje z balkonom, v večstanovanjski hiši. Park..."
6217913,LJ. VIČ,enosobno,1969,2005,3,36.5,139000.0,LJUBLJANA NEPREMIČNINE d.o.o.,"36,5 m2, 1-sobno, zgrajeno l. 1969, adaptirano l. 2005, 3/5 nad., prodamo. Cena: 139.000,00 EUR"
6221004,LJ. VIČ,garsonjera,2007,None,2,37.0,139000.0,Zasebna ponudba,"37 m2, garsonjera, zgrajena l. 2007, 2/3 nad., balkon, klima, dvigalo, velika klet, parkirno mesto, prodamo. Cena: 139.0..."
6194956,LJ. VIČ,enosobno,1968,None,5,40.0,114000.0,LJUBLJANA NEPREMIČNINE d.o.o.,"40 m2, 1-sobno, zgrajeno l. 1968, 5/5 nad., prodamo. Cena: 114.000,00 EUR"
6220708,LJ. VIČ,enosobno,1968,None,2,41.4,107000.0,Mreža nepremičnin d.o.o.,"41,4 m2, 1-sobno, zgrajeno l. 1968, 2. nad., prodamo. Cena: 107.000,00 EUR"
6219394,LJ. VIČ,enosobno,1973,2018,4,42.4,123000.0,MESTO NEPREMIČNIN d.o.o.,"42,4 m2, 1-sobno, zgrajeno l. 1973, adaptirano l. 2018, 4/4 nad., prostorno in svetlo enosobno stanovanje, prodamo. Cena..."
6219881,LJ. VIČ,dvosobno,1930,2018,None,46.0,127900.0,Mreža nepremičnin d.o.o.,"46 m2, 2-sobno, zgrajeno l. 1930, adaptirano l. 2018, prodamo. Cena: 127.900,00 EUR"
6217308,LJ. VIČ,dvoinpolsobno,1990,2012,1,47.0,134000.0,LJUBLJANA NEPREMIČNINE d.o.o.,"47 m2, 2,5-sobno, zgrajeno l. 1990, adaptirano l. 2012, 1/2 nad., odlično za investicijo, prodamo. Cena: 134.000,00 EUR"
6216788,LJ. VIČ,dvosobno,1987,None,1,50.0,159000.0,"Stoja trade, d.o.o., Ljubljana","50 m2, 2-sobno, zgrajeno l. 1987, 1/4 nad., Prodamo lepo stanovanje z južno usmeritvijo na mirni in lahko dostopni lokac..."
6218931,LJ. VIČ,dvosobno,1968,1988,2,51.77,129990.0,Mreža nepremičnin d.o.o.,"51,77 m2, 2-sobno, zgrajeno l. 1968, adaptirano l. 1988, 2/4 nad., prodamo. Cena: 129.990,00 EUR"
6201327,LJ. VIČ,dvoinpolsobno,1940,2013,1,53.0,137600.0,"Sans nepremičnine, d.o.o.","53 m2, 2,5-sobno, zgrajeno l. 1940, adaptirano l. 2013, 670 m2 zemljišča, 1/1 nad., prodamo. Cena: 137.600,00 EUR"
6195496,LJ. VIČ,dvosobno,1965,None,4,60.0,189000.0,Mreža nepremičnin d.o.o.,"60 m2, 2-sobno, zgrajeno l. 1965, 4/4 nad., prodamo. Cena: 189.000,00 EUR"
6194999,LJ. VIČ,dvosobno,1965,None,4,60.0,189000.0,Zasebna ponudba,"60 m2, 2-sobno, zgrajeno l. 1965, 4/4 nad., Lj-Vič 60 m2 2. sobno, zgrajeno 1965,4/4 nadstropja, opremljeno, novaa plins..."
6168774,LJ. VIČ,dvosobno,1965,None,2,60.48,205000.0,Zasebna ponudba,"60,48 m2, 2-sobno, zgrajeno l. 1965, 2/4 nad., Svetlo 2-sobno stanovanje z balkonom. 2 shrambi. ZK urejeno. Mirna lokaci..."
6208996,LJ. VIČ,dvosobno,1977,2015,4,61.6,169000.0,Mreža nepremičnin d.o.o.,"61,6 m2, 2-sobno, zgrajeno l. 1977, adaptirano l. 2015, 4/4 nad., prodamo. Cena: 169.000,00 EUR"
6208629,LJ. VIČ,dvosobno,1965,2013,4,62.59,189000.0,MESTO NEPREMIČNIN d.o.o.,"62,59 m2, 2-sobno, zgrajeno l. 1965, adaptirano l. 2013, 4/4 nad., opremljeno, zagotovljeno parkirišče, bližina šol, pro..."
6220176,LJ. VIČ,trisobno,1972,1996,4,67.4,168000.0,MESTO NEPREMIČNIN d.o.o.,"67,4 m2, 3-sobno, zgrajeno l. 1972, adaptirano l. 1996, 4/4 nad., odlična lokacija, svetlo stanovanje z balkonom, prodam..."
6208474,LJ. VIČ,dvosobno,1965,2004,VP,67.9,186900.0,"Sonce skupina d.o.o., PE Ljubljana","67,9 m2, 2-sobno, zgrajeno l. 1965, adaptirano l. 2004, VP/10 nad., blizu Centra, na Gorkičevi, prodamo izjemno prijetno..."
6217304,LJ. VIČ,triinpolsobno,1990,2012,2,68.0,154000.0,LJUBLJANA NEPREMIČNINE d.o.o.,"68 m2, 3,5-sobno, zgrajeno l. 1990, adaptirano l. 2012, 2/2 nad., Mansardno 3,5-sobno stanovanje s samostojnim vhodom, d..."
6196770,LJ. VIČ,trisobno,1930,None,None,70.0,260000.0,Novi list d.o.o.,"70 m2, 3-sobno, zgrajeno l. 1930, 290 m2 zemljišča, Na iskani lokaciji blizu centra mesta prodamo stanovanje v staromešč..."
6215465,LJ. VIČ,trisobno,1984,2018,4,70.4,186000.0,MESTO NEPREMIČNIN d.o.o.,"70,4 m2, 3-sobno, zgrajeno l. 1984, adaptirano l. 2018, 4/4 nad., na odlični lokaciji, v mirni in urejeni soseski, adapt..."
6210985,LJ. VIČ,trisobno,1984,2018,4,70.4,182000.0,"Stoja trade, d.o.o., Ljubljana","70,4 m2, 3-sobno, zgrajeno l. 1984, adaptirano l. 2018, 4/4 nad., Sprememba cene, vabljeni.Prodamo v celoti prenovljeno ..."
6175744,LJ. VIČ,dvoinpolsobno,1960,None,3,71.35,164900.0,"STAN nepremičnine d.o.o., Ljubljana","71,35 m2, 2,5-sobno, zgrajeno l. 1960, 3/4 nad., prodamo. Cena: 164.900,00 EUR"
6214756,LJ. VIČ,trisobno,1972,None,4,71.4,168000.0,MP PROJEKT d.o.o.,"71,4 m2, 3-sobno, zgrajeno l. 1972, 4. nad., velik zastekljen balkon, miren okoliš z veliko zelenih površin, prodamo. Ce..."
6221226,LJ. VIČ,trisobno,1972,None,None,71.4,173000.0,ABC nepremičnine d.o.o.,"71,4 m2, 3-sobno, zgrajeno l. 1972, prodamo. Cena: 173.000,00 EUR"
6219299,LJ. VIČ,trisobno,2008,None,3,76.2,239000.0,KREATIVDOM d.o.o.,"76,2 m2, 3-sobno, zgrajeno l. 2008, 3/5 nad., moderno zasnovano s parkiriščem v garaži na atraktivni lokaciji, prodamo. ..."
6215314,LJ. VIČ,trisobno,1922,None,None,78.7,269000.0,ABC nepremičnine d.o.o.,"78,7 m2, 3-sobno, zgrajeno l. 1922, prodamo. Cena: 269.000,00 EUR"
6190243,LJ. VIČ,dvoinpolsobno,2008,None,None,79.4,245000.0,"Nepremičnine KLEMENČIČ, Borut Klemenčič Hočevar s.p.","79,4 m2, 2,5-sobno, zgrajeno l. 2008, komfortno, z vsemi priključki, funkcionalno, opremljeno, zemljiškoknjižno etažno u..."
6132427,LJ. VIČ,trisobno,2011,None,P,83.4,349900.0,LJUBLJANA NEPREMIČNINE d.o.o.,"83,4 m2, 3-sobno, zgrajeno l. 2011, 114 m2 zemljišča, P/3 nad., primerno za investicijo, prodamo. Cena: 349.900,00 EUR"
6177072,LJ. VIČ,trisobno,2004,2009,2,85.0,265000.0,Zasebna ponudba,"85 m2, 3-sobno, zgrajeno l. 2004, adaptirano l. 2009, 2/3 nad., etažno gretje na plin, lastniški parkirni boks v podzemn..."
6198111,LJ. VIČ,dvoinpolsobno,1963,2018,3,85.7,299000.0,Rocco nepremičnine d.o.o.,"85,7 m2, 2,5-sobno, zgrajeno l. 1963, adaptirano l. 2018, 3. nad., Na odlični lokaciji v neposredni bližini središča mes..."
6216116,LJ. VIČ,dvoinpolsobno,2004,2004,2,89.8,189000.0,Rojal invest d.o.o.,"89,8 m2, 2,5-sobno, adaptirano l. 2004, 2/2 nad., prodamo. Cena: 189.000,00 EUR"
6219260,LJ. VIČ,dvoinpolsobno,2004,2004,2,89.8,189000.0,Rocco nepremičnine d.o.o.,"89,8 m2, 2,5-sobno, adaptirano l. 2004, 2/2 nad., Na Viču prodamo prostorno in funkcionalno 2,5 sobno stanovanje. Stanov..."
6202819,LJ. VIČ,štirisobno,2009,None,2,93.0,385000.0,Rocco nepremičnine d.o.o.,"93 m2, 4-sobno, zgrajeno l. 2009, 2. nad., Na Viču prodamo moderno zasnovano 4 sobno stanovanje, ki se nahaja v urejeni ..."
6211512,LJ. VIČ,trisobno,2008,None,2,100.2,295000.0,Rocco nepremičnine d.o.o.,"100,2 m2, 3-sobno, zgrajeno l. 2008, 2. nad., Na Viču prodamo moderno zasnovano 3 sobno stanovanje, ki se nahaja v ureje..."
6218939,LJ. VIČ,trisobno,1954,None,1,102.0,220000.0,"Central RE d.o.o., PE LJUBLJANA","102 m2, 3-sobno, zgrajeno l. 1954, 1/1 nad., prodamo. Cena: 220.000,00 EUR"
6221424,LJ. VIČ,štiriinpolsobno,1987,None,None,115.0,295000.0,"STAN nepremičnine d.o.o., Ljubljana","115 m2, 4,5-sobno, zgrajeno l. 1987, Potrebujete več prostora? V mirnem družinskem predelu Ljubljane na viču vas čaka st..."
6188689,LJ. VIČ,štirisobno,2002,None,None,128.0,590000.0,Rocco nepremičnine d.o.o.,"128 m2, 4-sobno, zgrajeno l. 2002, 100 m2 zemljišča, P+1/1 nad., prodamo. Cena: 590.000,00 EUR"
6153950,LJ. VIČ,štirisobno,1890,2004,1,140.0,350000.0,"Renex, Tadej Tanšek s.p.","140 m2, 4-sobno, zgrajeno l. 1890, adaptirano l. 2004, 1. nad., prodamo. Cena: 350.000,00 EUR"
6190732,LJ. VIČ,trisobno,2012,None,None,197.39,349900.0,"RECONSULT d.o.o., PE RCN, RECONSULT NEPREMIČNINE","197,39 m2, 3-sobno, zgrajeno l. 2012, prodamo. Cena: 349.900,00 EUR"
6216794,LJ. VIČ,štirisobno,2002,2016,2,150.5,405000.0,"Aeon nepremičnine, d.o.o., Century 21 Primorska","150,5 m2, 4-sobno, zgrajeno l. 2002, adaptirano l. 2016, 2/2 nad., prodamo. Cena: 405.000,00 EUR"
6215120,LJ. VIČ,trisobno,1976,2014,4,54.0,155000.0,Zasebna ponudba,"54 m2, 3-sobno, zgrajeno l. 1976, adaptirano l. 2014, 4/4 nad., Prodamo 3 sobno stanovanje. Vsebuje hodnik, spalnico, ot..."
6200019,LJ. VIČ,trisobno,2016,None,P,94.46,480000.0,Kupola nepremičnina d.o.o.,"94,46 m2, 3-sobno, novogradnja - zgr. l. 2016, 200 m2 zemljišča, pritličje, blizu starega mestnega jedra, 3 parkirišča, ..."
6200104,LJ. VIČ,petsobno,2016,None,None,235.0,890000.0,Kupola nepremičnina d.o.o.,"235 m2, 5 in večsobno, novogradnja - zgr. l. 2016, prodamo. Cena: 890.000,00 EUR"
6216088,LJ. VIČ,garsonjera,2001,None,4,30.0,108000.0,Mreža nepremičnin d.o.o.,"30 m2, garsonjera, zgrajena l. 2001, 4/4 nad., prodamo. Cena: 108.000,00 EUR"
6196664,LJ. VIČ,enosobno,1968,None,5,40.0,114000.0,ALEA nepremičninska družba d.o.o.,"40 m2, 1-sobno, zgrajeno l. 1968, 5/5 nad., Stanovanje z JV lego se nahaja na lokaciji obdani z veliko zelenja in rekrea..."
6184652,LJ. VIČ,triinpolsobno,2017,2017,1,179.71,355000.0,METKA HANUNA s.p.,"179,71 m2, 3,5-sobno, adaptirano l. 2017, 1/1 nad., v 2 stanovanjski vrstni hiši, nova streha, izolacija, fasada, nova o..."
6220390,LJ. VIČ,dvoinpolsobno,2004,None,2,89.0,189000.0,Medvešek Pušnik Nepremičnine d.o.o.,"89 m2, 2,5-sobno, zgrajeno l. 2004, 2. nad., stilsko dovršeno v rustikalnem toskanskem slogu, razgibano, vzorno ohranjen..."
6220283,LJ. VIČ,trisobno,2015,None,2,82.3,297000.0,KREATIVDOM d.o.o.,"82,3 m2, 3-sobno, zgrajeno l. 2015, 2/5 nad., prodamo. Cena: 297.000,00 EUR"
6209408,LJ. VIČ,trisobno,2002,None,3,104.0,278000.0,MESTO NEPREMIČNIN d.o.o.,"104 m2, 3-sobno, zgrajeno l. 2002, 3/3 nad., v prijetni in mirni soseski, varovani 24 ur, parkirni prostor pod zgradbo, ..."
6213459,LJ. VIČ,trisobno,1998,None,4,75.38,205000.0,Lares nepremičninska družba d.o.o.,"75,38 m2, 3-sobno, zgrajeno l. 1998, 4/4 nad., Na odlični lokaciji ob naselju Nova Grbina, ob Cesti na Brdo, prodamo lep..."
6206378,LJ. VIČ,trisobno,1998,None,4,75.38,220000.0,Lares nepremičninska družba d.o.o.,"75,38 m2, 3-sobno, zgrajeno l. 1998, 4/4 nad., Na odlični lokaciji ob naselju Nova Grbina, ob Cesti na Brdo, prodamo lep..."
5867227,LJ. VIČ,trisobno,2011,None,P,197.39,349900.0,Zasebna ponudba,"197,39 m2, 3-sobno, zgrajeno l. 2011, P/2 nad., prodamo. Cena: 349.900,00 EUR"
6144193,LJ. VIČ,štiriinpolsobno,2017,None,2,130.0,257443.0,"Nepremičnine M8, Lea Kavalič s.p.","130 m2, 4,5-sobno, zgrajeno l. 2017, 2/3 nad., V prelepem naravnem okolju, le 7 km iz Ljubljane prodamo prostorno 4,5 so..."
6212803,LJ. VIČ,enosobno,1966,None,3,30.4,99000.0,Realia d.o.o.,"30,4 m2, 1-sobno, zgrajeno l. 1966, 3/4 nad., 27,6 m2 bivalne površine, 2,8 m2 kleti, vsi priključki, domofon, S, delno ..."
6207798,LJ. VIČ,garsonjera,2004,None,1,32.0,125000.0,LJUBLJANA NEPREMIČNINE d.o.o.,"32 m2, garsonjera, zgrajena l. 2004, 1/2 nad., prodamo udobno garsonjero z velikim balkonom in lastniškim parkirnim mest..."
6197098,LJ. VIČ,trisobno,2004,None,1,86.65,233000.0,Zasebna ponudba,"86,65 m2, 3-sobno, zgrajeno l. 2004, 1/2 nad., prodamo. Cena: 233.000,00 EUR"
6213230,LJ. VIČ,dvoinpolsobno,2018,None,1,77.3,249000.0,Mernet d.o.o.,"77,3 m2, 2,5-sobno, zgrajeno l. 2018, 1/3 nad., V visoko kvalitetno zgrajeni zelo atraktivni novostanovanjski stavbi, pr..."
6187625,LJ. VIČ,trisobno,1999,None,P,86.0,289000.0,"Visa d.o.o., Ljubljana","86 m2, 3-sobno, zgrajeno l. 1999, 93 m2 zemljišča, pritličje, komfortno stanovanje na odlični lokaciji, lastniški atrij,..."
6219748,LJ. VIČ,trisobno,1999,None,2,67.2,181000.0,Mreža nepremičnin d.o.o.,"67,2 m2, 3-sobno, zgrajeno l. 1999, 2/3 nad., prodamo. Cena: 181.000,00 EUR"
6212912,LJ. VIČ,štiriinpolsobno,2004,2015,None,108.4,295000.0,Inalbea d.o.o.,"108,4 m2, 4,5-sobno, zgrajeno l. 2004, adaptirano l. 2015, Svetlo, simpatično, popolnoma in kakovostno opremljeno, lepo ..."
6220403,LJ. VIČ,štirisobno,2018,None,1,97.85,465000.0,Casa 69 d.o.o.,"97,85 m2, 4-sobno, novogradnja, začetek gradnje l. 2018, 1. nad., Na elitnem delu Viča, skoraj v samem središču mesta Lj..."
6220409,LJ. VIČ,štirisobno,2018,None,3,119.95,630000.0,Casa 69 d.o.o.,"119,95 m2, 4-sobno, novogradnja, začetek gradnje l. 2018, 3. nad., Na elitnem delu Viča, skoraj v samem središču mesta L..."
6216529,LJ. VIČ,dvoinpolsobno,1932,None,1,72.2,120500.0,Mikljič-Hribar Company d.o.o.,"72,2 m2, 2,5-sobno, zgrajeno l. 1932, 1/1 nad., Na Galjevici v 2-stanovanjski hiši prodamo 2.5 sobno stanovanje z veliko..."
6164333,LJ. VIČ,štirisobno,1998,None,2,122.0,379000.0,Zasebna ponudba,"122 m2, 4-sobno, zgrajeno l. 1998, 2/4 nad., sončno, CK, optika, parkirno mesto v garaži, velika shramba v kleti, dvoriš..."
6170204,LJ. VIČ,trisobno,2016,None,3,118.5,308000.0,Stanovanjski sklad RS,"118,5 m2, 3-sobno, zgrajeno l. 2016, 3. nad., prodamo. Cena: 308.000,00 EUR"
6183663,LJ. VIČ,štirisobno,2016,None,None,132.3,341000.0,Stanovanjski sklad RS,"132,3 m2, 4-sobno, v stavbi zgrajeni l. 2016, prodamo. Cena: 341.000,00 EUR"
6183660,LJ. VIČ,trisobno,2016,None,3,95.0,294000.0,Stanovanjski sklad RS,"95 m2, 3-sobno, v stavbi zgrajeni l. 2016, 3. nad., prodamo. Cena: 294.000,00 EUR"
6170170,LJ. VIČ,trisobno,2016,None,None,99.8,298000.0,Stanovanjski sklad RS,"99,8 m2, 3-sobno, zgrajeno l. 2016, prodamo. Cena: 298.000,00 EUR"
6183657,LJ. VIČ,dvosobno,2016,None,P,100.2,298000.0,Stanovanjski sklad RS,"100,2 m2, 2-sobno, v stavbi zgrajeni l. 2016, pritličje, prodamo. Cena: 298.000,00 EUR"
6221605,LJ. VIČ,dvosobno,2016,None,3,113.8,329000.0,Stanovanjski sklad RS,"113,8 m2, 2-sobno, zgrajeno l. 2016, 3. nad., prodamo. Cena: 329.000,00 EUR"
6183656,LJ. VIČ,štirisobno,2016,None,None,120.7,373000.0,Stanovanjski sklad RS,"120,7 m2, 4-sobno, v stavbi zgrajeni l. 2016, prodamo. Cena: 373.000,00 EUR"
6170162,LJ. VIČ,trisobno,2016,None,None,125.3,380000.0,Stanovanjski sklad RS,"125,3 m2, 3-sobno, zgrajeno l. 2016, prodamo. Cena: 380.000,00 EUR"
6217377,LJ. VIČ,štirisobno,2010,2010,2,96.0,184000.0,"Zeta, d.o.o., Piran","96 m2, 4-sobno, adaptirano l. 2010, 2/2 nad., sončno, odlična lokacija,3 spalni prostori, večji dnevni prostor z kuhinjo..."
6131102,LJ. VIČ,trisobno,1900,None,2,103.2,219000.0,Vehovar nepremičnine d.o.o.,"103,2 m2, 3-sobno, v stavbi zgrajeni l. 1900, 2/2 nad., delno mansardno, površina dela stavbe 103,20 m2 (87,90 m2 uporab..."
6188169,LJ. VIČ,petsobno,2002,2002,1,100.0,215000.0,"Dom-in, agencija d.o.o.","100 m2, 5 in večsobno, adaptirano l. 2002, 1/2 nad., Prostorno stanovanje na mirni, sončni lokaciji, v objektu, kjer je ..."
6216099,LJ. VIČ,štirisobno,2011,None,P,161.2,295000.0,Real Go d.o.o.,"161,2 m2, 4-sobno, zgrajeno l. 2011, P/4 nad., Posredujemo pri prodaji štiri sobnega atrijskega stanovanja s 125,40 m2 u..."
6212328,LJ. VIČ,trisobno,1984,2018,4,70.4,186000.0,KREATIVDOM d.o.o.,"70,4 m2, 3-sobno, zgrajeno l. 1984, adaptirano l. 2018, 4/4 nad., prijetna soseska, prenovljeno stanovanje z balkonom v ..."
6186009,LJ. VIČ,garsonjera,1965,None,5,24.0,79000.0,Zasebna ponudba,"24 m2, garsonjera, zgrajena l. 1965, 5. nad., prodamo. Cena: 79.000,00 EUR"
6212145,LJ. VIČ,trisobno,1958,2011,3,60.0,190000.0,MESTO NEPREMIČNIN d.o.o.,"60 m2, 3-sobno, zgrajeno l. 1958, adaptirano l. 2011, 3/3 nad., prijetno svetlo mansardno stanovanje, prodamo. Cena: 190..."
6217652,LJ. VIČ,trisobno,1962,2018,4,62.7,197000.0,Akcent d.o.o. Ljubljana,"62,7 m2, 3-sobno, zgrajeno l. 1962, adaptirano l. 2018, 4/4 nad., Posredujemo pri prodaji zelo prijetnega, svetlega, v c..."
6172671,LJ. VIČ,dvoinpolsobno,2006,None,P,55.0,260000.0,Zasebna ponudba,"55 m2, 2,5-sobno, oskrbovano stanovanje za starejše, zgrajeno l. 2006, 53 m2 zemljišča, P/4 nad., prodamo. Cena: 260.000..."
6218155,LJ. VIČ,dvoinpolsobno,1973,None,P,64.21,180000.0,Zasebna ponudba,"64,21 m2, 2,5-sobno, zgrajeno l. 1973, P/2 nad., prodamo. Cena: 180.000,00 EUR"
6112569,LJ. VIČ,triinpolsobno,1990,None,M,90.0,160000.0,ALEA nepremičninska družba d.o.o.,"90 m2, 3,5-sobno, zgrajeno l. 1990, M/1 nad., prijetno, lepo vzdrževano in v celoti opremljeno mansardno stanovanje v ve..."
6217094,LJ. VIČ,štirisobno,2018,None,1,97.85,465000.0,"STAN nepremičnine d.o.o., Ljubljana","97,85 m2, 4-sobno, novogradnja, začetek gradnje l. 2018, 1. nad., NOVOGRADNJA - Začetek gradnje 2018, vseljivo najpoznej..."
6217109,LJ. VIČ,štirisobno,2018,None,None,119.95,630000.0,"STAN nepremičnine d.o.o., Ljubljana","119,95 m2, 4-sobno, novogradnja, začetek gradnje l. 2018, NOVOGRADNJA - Začetek gradnje 2018, vseljivo najpozneje do nov..."
6221581,LJ. VIČ,garsonjera,1998,2018,4,29.6,108000.0,Rojal invest d.o.o.,"29,6 m2, garsonjera, zgrajena l. 1998, adaptirana l. 2018, 4/4 nad., prodamo. Cena: 108.000,00 EUR"
6210423,LJ. VIČ,trisobno,2002,2016,2,154.12,399000.0,Zasebna ponudba,"154,12 m2, 3-sobno, zgrajeno l. 2002, adaptirano l. 2016, 2/2 nad., V sodobnem naselju prodamo prostorno duplex stanovan..."
6148313,LJ. VIČ,trisobno,2011,None,None,83.4,349900.0,Lares nepremičninska družba d.o.o.,"83,4 m2, 3-sobno, zgrajeno l. 2011, Na odlični lokaciji ob robu Rožne doline, v sodobno zgrajeni vili je naprodaj odličn..."
6216848,LJ. VIČ,enosobno,1978,None,3,35.0,139000.0,Zasebna ponudba,"35 m2, 1-sobno, zgrajeno l. 1978, 3/11 nad., NUJNO PRODAM, 1 sobno stanovanje v stolpnici, Ljubljana Vič, 3. nadstropje,..."
6221047,LJ. VIČ,garsonjera,1966,None,None,29.8,89000.0,Agencia d.o.o.,"29,8 m2, garsonjera, zgrajena l. 1966, stanovanje (možna predelava v enosobno stanovanje) bruto površine 37.4 m2 (29.8 m..."
6217758,LJ. VIČ,dvosobno,1957,2012,VP,48.0,165000.0,Gradex nepremičnine d.o.o.,"48 m2, 2-sobno, zgrajeno l. 1957, adaptirano l. 2012, VP/4 nad., odlična lokacija, s parkiriščem pred blokom za rampo, k..."
6218476,LJ. VIČ,trisobno,1959,2016,3,71.0,179000.0,"Sans nepremičnine, d.o.o.","71 m2, 3-sobno, zgrajeno l. 1959, adaptirano l. 2016, 3/4 nad., prodamo. Cena: 179.000,00 EUR"
6216467,LJ. VIČ,dvoinpolsobno,1960,None,3,73.6,188000.0,HIP KA d.o.o.,"73,6 m2, 2,5-sobno, zgrajeno l. 1960, 3/4 nad., odlična lokacija, funkcionalen tloris, parkirno mesto za zapornico, prod..."
6216136,LJ. VIČ,dvoinpolsobno,1976,2014,4,53.7,155900.0,Mreža nepremičnin d.o.o.,"53,7 m2, 2,5-sobno, zgrajeno l. 1976, adaptirano l. 2014, 4/4 nad., prodamo. Cena: 155.900,00 EUR"
6212702,LJ. VIČ,dvosobno,1961,None,3,48.3,129000.0,"Nepremičnine Agencius, Kristijan Mohorko s.p.","48,3 m2, 2-sobno, zgrajeno l. 1961, 3/4 nad., prodamo. Cena: 129.000,00 EUR"
6219648,LJ. VIČ,garsonjera,2004,None,P,30.0,112500.0,Zasebna ponudba,"30 m2, garsonjera, zgrajena l. 2004, P/2 nad., Garsonjera se nahaja v vila bloku in ji pripada atrij (10 m2). Ima dnevno..."
6213682,LJ. VIČ,enoinpolsobno,1975,2011,2,39.0,128000.0,Veduta nepremičnine d.o.o.,"39 m2, 1,5-sobno, zgrajeno l. 1975, adaptirano l. 2011, 2/4 nad., Posredujemo pri prodaji popolno obnovljenega stanovanj..."
6192199,LJ. VIČ,trisobno,2011,None,None,83.4,323900.0,Lares nepremičninska družba d.o.o.,"83,4 m2, 3-sobno, zgrajeno l. 2011, 114 m2 zemljišča, Na odlični lokaciji ob robu Rožne doline, v sodobno zgrajeni vili ..."
6190481,LJ. VIČ,trisobno,1935,2017,VP,83.5,279000.0,MESTO NEPREMIČNIN d.o.o.,"83,5 m2, 3-sobno, zgrajeno l. 1935, adaptirano l. 2017, VP/2 nad., izredno svetlo, prostorno in letos prenovljeno trisob..."
6221456,LJ. VIČ,trisobno,1962,None,1,88.4,295000.0,Re-Domus nepremičninska družba d.o.o.,"88,4 m2, 3-sobno, zgrajeno l. 1962, 174 m2 zemljišča, 1/2 nad., Odlična, mirna lokacija, sončna lega, zemljišče 150 m2, ..."
6189284,LJ. VIČ,triinpolsobno,2013,None,2,112.2,420000.0,Rocco nepremičnine d.o.o.,"112,2 m2, 3,5-sobno, zgrajeno l. 2013, 2/2 nad., V urejenem naselju prodamo prestižno 3,5 sobno stanovanje, ki bo prepri..."
6198864,LJ. VIČ,štirisobno,2018,None,P,121.0,490200.0,Blok d.o.o.,"121 m2, 4-sobno, dupleks, zgrajeno l. 2018, P/2 nad., V dvostanovanjskem objektu v Rožni dolini prodamo sodobno zasnovan..."
6198871,LJ. VIČ,štirisobno,2018,None,P,123.0,499800.0,Blok d.o.o.,"123 m2, 4-sobno, dupleks, zgrajeno l. 2018, P/2 nad., V dvostanovanjskem objektu v Rožni dolini prodamo sodobno zasnovan..."
6173311,LJ. VIČ,štiriinpolsobno,1939,2011,1,264.0,480000.0,"Nepremičninska družba d.o.o., PE RE/MAX Vogal","264 m2, 4,5-sobno, zgrajeno l. 1939, adaptirano l. 2011, 200 m2 zemljišča, 1. nad., mirna, zelena lokacija, dupleks v dv..."
6208550,LJ. VIČ,petsobno,1998,None,1,117.0,279000.0,Svet RE d.o.o.,"117 m2, 5 in večsobno, zgrajeno l. 1998, 1. nad., svetlo, odprt pogled, v manjšem večstanovanjskem objektu, JV lega, pro..."
6092062,LJ. VIČ,trisobno,2008,2008,1,98.0,209990.0,"Sans nepremičnine, d.o.o.","98 m2, 3-sobno, adaptirano l. 2008, 1/1 nad., Zelo lepo svetli stanovanje na Rudniku blizu centra z dobro razporeditvijo..."
6194078,LJ. VIČ,štiriinpolsobno,2017,None,2,119.64,256982.54,Lares nepremičninska družba d.o.o.,"119,64 m2, 4,5-sobno, zgrajeno l. 2017, 2. nad., V novem mini naselju Gabrje je pravkar zgrajen stanovanjski objekt s tr..."
6217229,LJ. VIČ,enosobno,1968,None,5,42.7,119000.0,Hiša nepremičnine 1 d.o.o.,"42,7 m2, 1-sobno, zgrajeno l. 1968, 5/5 nad., prodamo. Cena: 119.000,00 EUR"
6207921,LJ. VIČ,trisobno,1933,2000,1,76.0,200000.0,"Abstract nepremičnine, Igor Kerin s.p.","76 m2, 3-sobno, zgrajeno l. 1933, adaptirano l. 2000, 1. nad., v starejši tristanovanjski hiši na iskani lokaciji z odpr..."
6220405,LJ. VIČ,trisobno,1983,None,4,72.3,270000.0,Realia d.o.o.,"72,3 m2, 3-sobno, zgrajeno l. 1983, 4. nad., uporabna površina 65,5 m2, balkon 4,5 m2, klet 2,3 m2, vsi priključki, opre..."
6195234,LJ. VIČ,trisobno,1896,2015,1,93.0,165000.0,Diamant nepremičnine d.o.o.,"93 m2, 3-sobno, zgrajeno l. 1896, adaptirano l. 2015, 1/2 nad., zelo prostorno, funkcionalno razporejeno in svetlo stano..."
6160995,LJ. VIČ,trisobno,2009,None,3,120.0,295000.0,ABA d.o.o.,"120 m2, 3-sobno, &quot;penthouse&quot;, zgrajeno l. 2009, 3/3 nad., Prodamo lepo opremljeno 3 sobno, zelo svetlo, odprto..."
6214145,LJ. VIČ,štirisobno,2018,None,P,133.0,419000.0,Vuitea d.o.o.,"133 m2, 4-sobno, zgrajeno l. 2018, 203 m2 zemljišča, P/2 nad., Na krasni lokaciji, nedaleč stran od centra prestolnice, ..."
6219504,LJ. VIČ,dvoinpolsobno,1964,None,4,61.2,157000.0,"Erjavec nepremičnine, Erjavec Dušan s.p.","61,2 m2, 2,5-sobno, zgrajeno l. 1964, 4/4 nad., Na dobri lokaciji blizu Centra (1,5 km do Kongresnega trga), nasproti Il..."
6183672,LJ. VIČ,dvosobno,2016,None,None,100.2,302000.0,Stanovanjski sklad RS,"100,2 m2, 2-sobno, zgrajeno l. 2016, prodamo. Cena: 302.000,00 EUR"
6186656,LJ. VIČ,štirisobno,2000,None,1,100.0,255000.0,Harmonija nepremičnine Ksenja Kokalj s.p.,"100 m2, 4-sobno, dupleks, zgrajeno l. 2000, 1/1 nad., velik balkon 13,6 m2 novejše, razgibano, z opremo, 2 parkirna mest..."
6212594,LJ. VIČ,dvosobno,2008,2008,P,49.0,145000.0,Telemax pro d.o.o.,"49 m2, 2-sobno, adaptirano l. 2008, adaptirano l. 2008, P/1 nad., prodamo. Cena: 145.000,00 EUR"
6207353,LJ. VIČ,trisobno,2010,2010,VP,68.2,199000.0,Re-Domus nepremičninska družba d.o.o.,"68,2 m2, 3-sobno, adaptirano l. 2010, 27 m2 zemljišča, VP/4 nad., Odlična lokacija, mirna lega, stanovanje z atrijem 27,..."
6219274,LJ. VIČ,trisobno,2008,None,3,82.6,239000.0,Zasebna ponudba,"82,6 m2, 3-sobno, zgrajeno l. 2008, 3/5 nad., Parkirišče v garaži, CK plin, optika, dvigalo, kolesarnica, shramba, ograj..."
6202321,LJ. VIČ,trisobno,1984,2018,4,72.0,182000.0,Zasebna ponudba,"72 m2, 3-sobno, zgrajeno l. 1984, adaptirano l. 2018, 4/4 nad., Prodamo 3-sobno adaptirano stanovanje na viški cesti 55...."
6213989,LJ. VIČ,trisobno,2008,None,1,102.0,330000.0,Zasebna ponudba,"102 m2, 3-sobno, zgrajeno l. 2008, 1/5 nad., moderno zasnovano, svetlo, prostorno stanovanje na Viški cesti, prodamo. Ce..."
6102281,LJ. VIČ,dvosobno,1930,None,1,44.1,118000.0,Rocco nepremičnine d.o.o.,"44,1 m2, 2-sobno, zgrajeno l. 1930, 1. nad., Na Vrhovcih prodamo lepo, svetlo 2 sobno stanovanje, ki se nahaja v 1. nads..."
6215917,LJ. VIČ,trisobno,2015,None,2,82.29,297000.0,Zasebna ponudba,"82,29 m2, 3-sobno, novogradnja - zgr. l. 2015, 2/5 nad., Prodamo stanovanje Zeleni gaj - samo resnim kupcem. (z agencija..."
6211862,MIRJE,trisobno,1922,2013,1,78.7,269000.0,LJUBLJANA NEPREMIČNINE d.o.o.,"78,7 m2, 3-sobno, zgrajeno l. 1922, adaptirano l. 2013, 1/1 nad., prodamo. Cena: 269.000,00 EUR"
6210791,MOSTEC,štirisobno,2001,None,1,98.8,325000.0,Rocco nepremičnine d.o.o.,"98,8 m2, 4-sobno, zgrajeno l. 2001, 1. nad., V mirni soseski v Mostecu prodamo prijetno stanovanje s čudovito teraso in ..."
6196228,MURGLE,enosobno,2011,None,1,37.18,179000.0,LJUBLJANA NEPREMIČNINE d.o.o.,"37,18 m2, 1-sobno, zgrajeno l. 2011, 1/3 nad., prodamo. Cena: 179.000,00 EUR"
6166465,MURGLE,dvosobno,2018,None,P,45.11,179000.0,Zasebna ponudba,"45,11 m2, 2-sobno, oskrbovano stanovanje za starejše, zgrajeno l. 2018, pritličje, prodamo. Cena: 179.000,00 EUR"
6213228,MURGLE,štirisobno,1958,None,M,65.0,183000.0,LJUBLJANA NEPREMIČNINE d.o.o.,"65 m2, 4-sobno, zgrajeno l. 1958, M/2 nad., mirna, sončna lokacija, razgibano mansardno stanovanje, prodamo. Cena: 183.0..."
6210424,MURGLE,dvosobno,2018,None,P,125.62,350000.0,Mijaks investicije d.o.o.,"125,62 m2, 2-sobno, oskrbovano stanovanje za starejše, novogradnja - zgr. l. 2018, P/3 nad., Prosto stanovanje v novo zg..."
6220442,MURGLE,dvosobno,2018,None,3,81.7,269000.0,Rojal invest d.o.o.,"81,7 m2, 2-sobno, oskrbovano stanovanje za starejše, zgrajeno l. 2018, 3. nad., prodamo. Cena: 269.000,00 EUR"
6181850,NADGORICA,trisobno,1937,1999,P,55.2,125000.0,"Nepremičninska agencija ""TLORIS"" Miro Torić s.p., Poslovna enota","55,2 m2, 3-sobno, zgrajeno l. 1937, adaptirano l. 1999, P/1 nad., prodamo. Cena: 125.000,00 EUR"
